It is difficult to be certain how the administration views that $28 million  since the views of one leader may not be the same as the views of another one .,en,en,en
But if the administration should find it does not need the $28 million for a grant-in-aid program  a not unlikely conclusion  it could very well seek a way to use the money for other purposes .,en,en,en
This would be in perfect consonance with the underlying concern in the administration -- the shortage of cash .,en,en,en
It could become an acute problem in the coming fiscal year .,en,en,en
If the administration does not succeed in passing the sales tax bill  or any other tax bill  it could very well be faced this spring at the fiscal session of the Legislature with an interesting dilemma .,en,en,en
Since the constitution forbids introduction of a tax bill at a fiscal session  the administration will either have to cut down expenses or inflate its estimates of anticipated revenues .,en,en,en
In either case  it could call a special session of the Legislature later in 1961 to make another stab at raising additional revenues through a tax raiser .,en,en,en
The prospect of cutting back spending is an unpleasant one for any governor .,en,en,en
It is one that most try to avoid  as long as they can see an alternative approach to the problem .,en,en,en
But if all alternatives should be clearly blocked off  it can be expected the Davis administration will take steps to trim spending at the spring session of the state Legislature .,en,en,en
This might be done to arouse those who have been squeezed out by the trims to exert pressure on the Legislature  so it would be more receptive to a tax proposal later in the year .,en,en,en
A constant problem confronting Davis on any proposals for new taxes will be the charge by his foes that he has not tried to economize .,en,en,en
Any tax bill also will revive allegations that some of his followers have been using their administration affiliations imprudently to profit themselves .,en,en,en
The new year might see some house-cleaning  either genuine or token  depending upon developments  to give Davis an opportunity to combat some of these criticisms .,en,en,en
City Controller Alexander Hemphill charged Tuesday that the bids on the Frankford Elevated repair project were rigged to the advantage of a private contracting company which had `` an inside track '' with the city .,en,en,en
Estimates of the city's loss in the $344000 job have ranged as high as $200000 .,en,en,en
Hemphill said that the Hughes Steel Erection Co. contracted to do the work at an impossibly low cost with a bid that was far less than the `` legitimate '' bids of competing contractors .,en,en,en
The Hughes concern then took `` shortcuts '' on the project but got paid anyway  Hemphill said .,en,en,en
The Controller's charge of rigging was the latest development in an investigation which also brought these disclosures Tuesday :,en,en,en
The city has sued for the full amount of the $172400 performance bond covering the contract .,en,en,en
The Philadelphia Transportation Co. is investigating the part its organization played in reviewing the project .,en,en,en
The signature of Harold V. Varani  former director of architecture and engineering in the Department of Public Property  appeared on payment vouchers certifying work on the project .,en,en,en
Varani has been fired on charges of accepting gifts from the contractor .,en,en,en
Managing Director Donald C. Wagner has agreed to cooperate fully with Hemphill after a period of sharp disagreement on the matter .,en,en,en
The announcement that the city would sue for recovery on the performance bond was made by City Solicitor David Berger at a press conference following a meeting in the morning with Wagner and other officials of the city and the PTC as well as representatives of an engineering firm that was pulled off the El project before its completion in 1959 .,en,en,en
The Hughes company and the Consolidated Industries  Inc.  both of 3646 N. 2d St.  filed for reorganization under the Federal bankruptcy law .,en,en,en
On Monday  the Hughes concern was formally declared bankrupt after its directors indicated they could not draw up a plan for reorganization .,en,en,en
Business relations between the companies and city have been under investigation by Hemphill and District Attorney James C. Crumlish  Jr. .,en,en,en
Intervenes in case,en,en,en
The suit was filed later in the day in Common Pleas Court 7 against the Hughes company and two bonding firms .,en,en,en
Travelers Indemnity Co. and the Continental Casualty Co. .,en,en,en
At Berger's direction  the city also intervened in the Hughes bankruptcy case in U. S. District Court in a move preliminary to filing a claim there .,en,en,en
`` I am taking the position that the contract was clearly violated ''  Berger said .,en,en,en
The contract violations mostly involve failure to perform rehabilitation work on expansion joints along the El track .,en,en,en
The contract called for overhauling of 102 joints .,en,en,en
The city paid for work on 75  of which no more than 21 were repaired  Hemphill charged .,en,en,en
Wide range in bids,en,en,en
Hemphill said the Hughes concern contracted to do the repairs at a cost of $500 for each joint .,en,en,en
The bid from A. Belanger and Sons of Cambridge  Mass.  which listed the same officers as Hughes  was $600 per joint .,en,en,en
But  Hemphill added  bids from other contractors ranged from $2400 to $3100 per joint .,en,en,en
Berger's decision to sue for the full amount of the performance bond was questioned by Wagner in the morning press conference .,en,en,en
Wagner said the city paid only $37500 to the Hughes company .,en,en,en
`` We won't know the full amount until we get a full report ''  Wagner said .,en,en,en
`` We can claim on the maximum amount of the bond ''  Berger said .,en,en,en
Wagner replied  `` Can't you just see the headline : ' City Hooked for $172000 ' '' ? ?,en,en,en
' know enough to sue ',en,en,en
Berger insisted that `` we know enough to sue for the full amount '' .,en,en,en
Douglas M. Pratt  president of the PTC  who attended the meeting  said the transit company is reviewing the work on the El .,en,en,en
`` We want to find out who knew about it ''  Pratt said .,en,en,en
`` Certain people must have known about it '' .,en,en,en
`` The PTC is investigating the whole matter ''  Pratt said .,en,en,en
Samuel D. Goodis  representing the Philadelphia Hotel Association  objected on Tuesday to a proposed boost by the city in licensing fees  saying that occupancy rates in major hotels here ranged from 48 to 74 percent last year .,en,en,en
Goodis voiced his objection before City Council's Finance Committee .,en,en,en
For hotels with 1000 rooms  the increased license fee would mean an expense of $5000 a year  Goodis said .,en,en,en
Testifies at hearing,en,en,en
His testimony came during a hearing on a bill raising fees for a wide variety of licenses  permits and city services .,en,en,en
The new fees are expected to raise an additional $740000 in the remainder of 1961 and $2330000 more a year after that .,en,en,en
The ordinance would increase the fee for rooming houses  hotels and multi-family dwellings to $5 a room .,np,en,en
The cost of a license now is $2  with an annual renewal fee of $1 .,en,en,en
Goodis said that single rooms account for 95 percent of the accomodations in some hotels .,en,en,en
The city expects the higher rooming house  hotel and apartment house fees to bring in an additional $457000 a year .,en,en,en
The increase also was opposed by Leonard Kaplan  spokesman for the Home Builders Association of Philadelphia  on behalf of association members who operate apartment houses .,en,en,en
A proposal to raise dog license fees drew an objection from Councilwoman Virginia Knauer  who formerly raised pedigreed dogs .,en,en,en
The ordinance would increase fees from $1 for males and $2 for females to a flat $5 a dog .,en,en,en
Mrs. Knauer said she did not think dog owners should be penalized for the city's services to animal care .,en,en,en
In reply  Deputy Police Commissioner Howard R. Leary said that the city spends more than $115000 annually to license and regulate dogs but collects only $43000 in fees .,en,en,en
He reported that the city's contributions for animal care included $67000 to the Women's S.P.C.A. ; ;,en,en,en
$15000 to pay six policemen assigned as dog catchers and $15000 to investigate dog bites .,en,en,en
Backs higher fees,en,np2,en
City Finance Director Richard J. McConnell indorsed the higher fees  which  he said  had been under study for more than a year .,en,en,en
The city is not adequately compensated for the services covered by the fees  he said .,en,en,en
The new fee schedule also was supported by Commissioner of Licenses and Inspections Barnet Lieberman and Health Commissioner Eugene A. Gillis .,en,en,en
Petitions asking for a jail term for Norristown attorney Julian W. Barnard will be presented to the Montgomery County Court Friday  it was disclosed Tuesday by Horace A. Davenport  counsel for the widow of the man killed last Nov. 1 by Barnard's hit-run car .,en,en,en
The petitions will be presented in open court to President Judge William F. Dannehower  Davenport said .,en,en,en
Barnard  who pleaded no defense to manslaughter and hit-run charges  was fined $500 by Judge Warren K. Hess  and placed on two years' probation providing he does not drive during that time .,en,en,en
He was caught driving the day after the sentence was pronounced and given a warning .,en,en,en
Victim of the accident was Robert Lee Stansbery  39 .,en,en,en
His widow started the circulation of petitions after Barnard was reprimanded for violating the probation .,en,en,en
The City Planning Commission on Tuesday approved agreements between two redevelopers and the Redevelopment Authority for the purchase of land in the $300000000 Eastwick Redevelopment Area project .,en,en,en
The commission also approved a novel plan that would eliminate traffic hazards for pedestrians in the project .,en,en,en
One of the agreements calls for the New Eastwick Corp. to purchase a 1311 acre tract for $12192865 .,np,en,en
The tract is bounded by Island Ave.  Dicks Ave.  61st St.  and Eastwick Ave. .,en,en,en
Four parks planned,en,np2,en
It is designated as Stage 1 Residential on the Redevelopment Authority's master plan and will feature row houses  garden apartments  four small parks  schools  churches  a shopping center and several small clusters of stores .,np,en,en
The corporation was formed by the Reynolds Metal Co. and the Samuel A. and Henry A. Berger firm  a Philadelphia builder  for work in the project .,en,en,en
The second agreement permits the authority to sell a 520-acre tract west of Stage 1 Residential to Philadelphia Builders Eastwick Corp.  a firm composed of 10 Philadelphia area builders  which is interested in developing part of the project .,en,en,en
Would bar vehicles,en,np2,en
The plan for eliminating traffic hazards for pedestrians was developed by Dr. Constantinos A. Doxiadis  former Minister of Reconstruction in Greece and a consulting planner for the New Eastwick Corp. .,en,en,en
The plan calls for dividing the project into 16 sectors which would be barred to vehicular traffic .,np,en,en
It provides for a series of landscaped walkways and a central esplanade that would eventually run through the center of the entire two-and-a-half-mile length of the project .,en,en,en
The esplanade eliminates Grovers Ave.  which on original plans ran through the center of the development .,en,en,en
The esplanade would feature pedestrian bridges over roads in the project .,en,en,en
Kansas City  Mo.  Feb. 9 ( UPI ),en,en,en
-- The president of the Kansas City local of the International Association of Fire Fighters was severly injured today when a bomb tore his car apart as he left home for work .,en,en,en
Battalion Chief Stanton M. Gladden  42  the central figure in a representation dispute between the fire fighters association and the teamsters union  suffered multiple fractures of both ankles .,en,en,en
He was in Baptist Memorial hospital .,en,en,en
Ignition sets off blast,en,en,en
The battalion chief said he had just gotten into his 1958 model automobile to move it from the driveway of his home so that he could take his other car to work .,en,en,en
`` I'd just turned on the ignition when there was a big flash and I was lying on the driveway ''  he said .,en,en,en
Gladden's wife and two of his sons  John  17  and Jim  13  were inside the house .,en,en,en
The younger boy said the blast knocked him out of bed and against the wall .,en,en,en
Hood flies over house,en,en,en
The explosion sent the hood of the car flying over the roof of the house .,en,en,en
The left front wheel landed 100 feet away .,en,en,en
Police laboratory technicians said the explosive device  containing either TNT or nitroglycerine  was apparently placed under the left front wheel .,en,en,en
It was first believed the bomb was rigged to the car's starter .,en,en,en
Gladden had been the target of threatening telephone calls in recent months and reportedly received one last night .,np,en,en
The fire department here has been torn for months by dissension involving top personnel and the fight between the fire fighters association and the teamsters union .,en,en,en
Led fight on teamsters,en,en,en
Gladden has been an outspoken critic of the present city administration and led his union's battle against the teamsters  which began organizing city firemen in 1959 .,en,en,en
The fire fighters association here offered a $5000 reward for information leading to the arrest of the person or persons responsible for the bombing .,en,en,en
A $500 reward was offered by the association's local in Kansas City  Kas. .,en,en,en
The association said it would post 24 hour guards at Gladden's home and at those of James Mining and Eugene Shiflett .,en,en,en
Mining is secretary-treasurer of the local and Shiflett is a member of its executive committee .,en,en,en
Both have been active in the association .,en,en,en
Ankara  Turkey  Oct. 24 ( AP ),en,en,en
-- Turkish political leaders bowed today to military pressure and agreed to form an emergency national front government with Gen. Cemal Gursel as president .,en,en,en
An agreement between the leaders of four parties which contested indecisive elections on Oct. 15 was reached after almost 18 hours of political bargaining under the threat of an army coup d'etat .,en,en,en
By-passing the military junta which has ruled Turkey since the overthrow of Premier Adnan Menderes 17 months ago  the army general staff  led by Gen. Cedvet Sunay  had set a deadline for the parties to join in a national coalition government .,en,en,en
The army leaders threatened to form a new military government if the parties failed to sign an eight point protocol agreeing on Gen. Gursel as president .,en,en,en
Gen. Gursel has headed the military junta the last 17 months .,en,en,en
The military also had demanded pledges that there would be no changes in the laws passed by the junta and no leaders of the Menderes regime now in prison would be pardoned .,en,en,en
Party leaders came out of the final meeting apparently satisfied and stated that complete agreement had been reached on a solution to the crisis created by the elections which left no party with enough strength to form a government on its own .,en,en,en
Vincent G. Ierulli has been appointed temporary assistant district attorney  it was announced Monday by Charles E. Raymond  District Attorney .,en,en,en
Ierulli will replace Desmond D. Connall who has been called to active military service but is expected back on the job by March 31 .,en,en,en
Ierulli  29  has been practicing in Portland since November  1959 .,en,en,en
He is a graduate of Portland University and the Northwestern College of Law .,en,en,en
He is married and the father of three children .,en,en,en
Helping foreign countries to build a sound political structure is more important than aiding them economically  E. M. Martin  assistant secretary of state for economic affairs told members of the World Affairs Council Monday night .,en,en,en
Martin  who has been in office in Washington  D. C.  for 13 months spoke at the council's annual meeting at the Multnomah Hotel .,en,en,en
He told some 350 persons that the United States' challenge was to help countries build their own societies their own ways  following their own paths .,en,en,en
`` We must persuade them to enjoy a way of life which  if not identical  is congenial with ours ''  he said but adding that if they do not develop the kind of society they themselves want it will lack ritiuality and loyalty .,en,en,en
Insuring that the countries have a freedom of choice  he said  was the biggest detriment to the Soviet Union .,en,en,en
He cited East Germany where after 15 years of Soviet rule it has become necessary to build a wall to keep the people in  and added  `` so long as people rebel  we must not give up '' .,en,en,en
Martin called for patience on the part of Americans .,en,en,en
`` The countries are trying to build in a decade the kind of society we took a century to build ''  he said .,en,en,en
By leaving our doors open the United States gives other peoples the opportunity to see us and to compare  he said .,en,en,en
Individual help best,en,en,en
`` We have no reason to fear failure  but we must be extraordinarily patient ''  the assistant secretary said .,en,en,en
Economically  Martin said  the United States could best help foreign countries by helping them help themselves .,en,en,en
Private business is more effective than government aid  he explained  because individuals are able to work with the people themselves .,en,en,en
The United States must plan to absorb the exported goods of the country  at what he termed a `` social cost '' .,en,en,en
Martin said the government has been working to establish firmer prices on primary products which may involve the total income of one country .,en,en,en
The Portland school board was asked Monday to take a positive stand towards developing and coordinating with Portland's civil defense more plans for the city's schools in event of attack .,en,en,en
But there seemed to be some difference of opinion as to how far the board should go  and whose advice it should follow .,en,en,en
The board members  after hearing the coordination plea from Mrs. Ralph H. Molvar  1409 SW Maplecrest Dr.  said they thought they had already been cooperating .,en,en,en
Chairman C. Richard Mears pointed out that perhaps this was not strictly a school board problem  in case of atomic attack  but that the board would cooperate so far as possible to get the children to where the parents wanted them to go .,en,en,en
Dr. Melvin W. Barnes  superintendent  said he thought the schools were waiting for some leadership  perhaps on the national level  to make sure that whatever steps of planning they took would `` be more fruitful ''  and that he had found that other school districts were not as far along in their planning as this district .,en,en,en
`` Los Angeles has said they would send the children to their homes in case of disaster ''  he said .,en,en,en
`` Nobody really expects to evacuate .,en,en,en
I think everybody is agreed that we need to hear some voice on the national level that would make some sense and in which we would have some confidence in following .,en,en,en
Mrs. Molvar  who kept reiterating her request that they `` please take a stand ''  said  `` We must have faith in somebody -- on the local level  and it wouldn't be possible for everyone to rush to a school to get their children '' .,en,en,en
Dr. Barnes said that there seemed to be feeling that evacuation plans  even for a high school where there were lots of cars `` might not be realistic and would not work '' .,en,en,en
Mrs. Molvar asked again that the board join in taking a stand in keeping with Jack Lowe's program .,en,en,en
The board said it thought it had gone as far as instructed so far and asked for more information to be brought at the next meeting .,en,en,en
It was generally agreed that the subject was important and the board should be informed on what was done  is going to be done and what it thought should be done .,en,en,en
Salem ( AP ),en,en,en
-- The statewide meeting of war mothers Tuesday in Salem will hear a greeting from Gov. Mark Hatfield .,en,en,en
Hatfield also is scheduled to hold a public United Nations Day reception in the state capitol on Tuesday .,en,en,en
His schedule calls for a noon speech Monday in Eugene at the Emerald Empire Kiwanis Club .,np,en,en
He will speak to Willamette University Young Republicans Thursday night in Salem .,en,en,en
On Friday he will go to Portland for the swearing in of Dean Bryson as Multnomah County Circuit Judge .,en,en,en
He will attend a meeting of the Republican State Central Committee Saturday in Portland and see the Washington-Oregon football game .,en,en,en
Beaverton School District No. 48 board members examined blueprints and specifications for two proposed junior high schools at a Monday night workshop session .,en,en,en
A bond issue which would have provided some $3.5 million for construction of the two 900-student schools was defeated by district voters in January .,en,en,en
Last week the board  by a 4 to 3 vote  decided to ask voters whether they prefer the 6-3-3 ( junior high school ) system or the 8-4 system .,en,en,en
Board members indicated Monday night this would be done by an advisory poll to be taken on Nov. 15  the same date as a $581000 bond election for the construction of three new elementary schools .,en,en,en
Secretary of Labor Arthur Goldberg will speak Sunday night at the Masonic Temple at a $25-a-plate dinner honoring Sen. Wayne L. Morse  Aj .,en,en,en
The dinner is sponsored by organized labor and is scheduled for 7 p.m. .,en,en,en
Secretary Goldberg and Sen. Morse will hold a joint press conference at the Roosevelt Hotel at 4:30 p.m. Sunday  Blaine Whipple  executive secretary of the Democratic Party of Oregon  reported Tuesday .,en,en,en
Other speakers for the fund-raising dinner include Reps. Edith Green and Al Ullman  Labor Commissioner Norman Nilsen and Mayor Terry Schrunk  all Democrats .,en,en,en
Oak Grove ( special ),en,en,en
-- Three positions on the Oak Lodge Water district board of directors have attracted 11 candidates .,en,en,en
The election will be Dec. 4 from 8 a.m. to 8 p.m. .,en,en,en
Polls will be in the water office .,en,en,en
Incumbent Richard Salter seeks re-election and is opposed by Donald Huffman for the five-year term .,en,en,en
Incumbent William Brod is opposed in his re-election bid by Barbara Njust  Miles C. Bubenik and Frank Lee .,en,en,en
Five candidates seek the place vacated by Secretary Hugh G. Stout .,en,en,en
Seeking this two-year term are James Culbertson  Dwight M. Steeves  James C. Piersee  W.M. Sexton and Theodore W. Heitschmidt .,en,en,en
A stronger stand on their beliefs and a firmer grasp on their future were taken Friday by delegates to the 29th general council of the Assemblies of God  in session at the Memorial Coliseum .,en,en,en
The council revised  in an effort to strengthen  the denomination's 16 basic beliefs adopted in 1966 .,en,en,en
The changes  unanimously adopted  were felt necessary in the face of modern trends away from the Bible .,en,en,en
The council agreed it should more firmly state its belief in and dependence on the Bible .,en,en,en
At the adoption  the Rev. T. F. Zimmerman  general superintendent  commented  `` The Assemblies of God has been a bulwark for fundamentalism in these modern days and has  without compromise  stood for the great truths of the Bible for which men in the past have been willing to give their lives '' .,np,en,en
New point added,en,en,en
Many changes involved minor editing and clarification ; ;,en,en,en
however  the first belief stood for entire revision with a new third point added to the list .,en,en,en
The first of 16 beliefs of the denomination  now reads :,en,en,en
`` The scriptures  both Old and New Testament  are verbally inspired of God and are the revelation of God to man  the infallible  authoritative rule of faith and conduct '' .,en,en,en
The third belief  in six points  emphasizes the Diety of the Lord Jesus Christ  and :,en,en,en
-- emphasizes the Virgin birth,en,en,en
-- the sinless life of Christ,en,en,en
-- His miracles,en,en,en
-- His substitutionary work on the cross,en,en,en
-- His bodily resurrection from the dead,en,en,en
-- and His exaltation to the right hand of God .,en,en,en
Super again elected,en,en,en
Friday afternoon the Rev. T. F. Zimmerman was reelected for his second consecutive two-year term as general superintendent of Assemblies of God .,en,en,en
His offices are in Springfield  Mo. .,en,en,en
Election came on the nominating ballot .,en,en,en
Friday night the delegates heard the need for their forthcoming program  `` Breakthrough '' scheduled to fill the churches for the next two years .,en,en,en
In his opening address Wednesday the Rev. Mr. Zimmerman  urged the delegates to consider a 10-year expansion program  with `` Breakthrough '' the theme for the first two years .,en,en,en
The Rev. R. L. Brandt  national secretary of the home missions department  stressed the need for the first two years' work .,en,en,en
`` Surveys show that one out of three Americans has vital contact with the church .,en,en,en
This means that more than 100 million have no vital touch with the church or religious life ''  he told delegates Friday .,en,en,en
Church loses pace,en,en,en
Talking of the rapid population growth ( upwards of 12000 babies born daily ) with an immigrant entering the United States every 1-1/2 minutes  he said `` our organization has not been keeping pace with this challenge '' .,en,en,en
