The Fulton County Grand Jury said Friday an investigation of Atlanta's recent primary election produced `` no evidence '' that any irregularities took place .,en,en,en
The jury further said in term-end presentments that the City Executive Committee  which had over-all charge of the election  `` deserves the praise and thanks of the City of Atlanta '' for the manner in which the election was conducted .,en,en,en
The September-October term jury had been charged by Fulton Superior Court Judge Durwood Pye to investigate reports of possible `` irregularities '' in the hard-fought primary which was won by Mayor-nominate Ivan Allen Jr. .,np,en,en
`` Only a relative handful of such reports was received ''  the jury said  `` considering the widespread interest in the election  the number of voters and the size of this city '' .,en,en,en
The jury said it did find that many of Georgia's registration and election laws `` are outmoded or inadequate and often ambiguous '' .,en,en,en
It recommended that Fulton legislators act `` to have these laws studied and revised to the end of modernizing and improving them '' .,en,en,en
The grand jury commented on a number of other topics  among them the Atlanta and Fulton County purchasing departments which it said `` are well operated and follow generally accepted practices which inure to the best interest of both governments '' .,en,en,en
However  the jury said it believes `` these two offices should be combined to achieve greater efficiency and reduce the cost of administration '' .,en,en,en
The City Purchasing Department  the jury said  `` is lacking in experienced clerical personnel as a result of city personnel policies '' .,en,en,en
It urged that the city `` take steps to remedy '' this problem .,en,en,en
Implementation of Georgia's automobile title law was also recommended by the outgoing jury .,en,en,en
It urged that the next Legislature `` provide enabling funds and re-set the effective date so that an orderly implementation of the law may be effected '' .,en,en,en
The grand jury took a swipe at the State Welfare Department's handling of federal funds granted for child welfare services in foster homes .,en,en,en
`` This is one of the major items in the Fulton County general assistance program ''  the jury said  but the State Welfare Department `` has seen fit to distribute these funds through the welfare departments of all the counties in the state with the exception of Fulton County  which receives none of this money .,en,en,en
The jurors said they realize `` a proportionate distribution of these funds might disable this program in our less populous counties '' .,en,en,en
Nevertheless  `` we feel that in the future Fulton County should receive some portion of these available funds ''  the jurors said .,en,en,en
`` Failure to do this will continue to place a disproportionate burden '' on Fulton taxpayers .,en,en,en
The jury also commented on the Fulton ordinary's court which has been under fire for its practices in the appointment of appraisers  guardians and administrators and the awarding of fees and compensation .,np,en,en
The jury said it found the court `` has incorporated into its operating procedures the recommendations '' of two previous grand juries  the Atlanta Bar Association and an interim citizens committee .,en,en,en
`` These actions should serve to protect in fact and in effect the court's wards from undue costs and its appointed and elected servants from unmeritorious criticisms ''  the jury said .,en,en,en
Regarding Atlanta's new multi-million-dollar airport  the jury recommended `` that when the new management takes charge Jan. 1 the airport be operated in a manner that will eliminate political influences '' .,np,en,en
The jury did not elaborate  but it added that `` there should be periodic surveillance of the pricing practices of the concessionaires for the purpose of keeping the prices reasonable '' .,en,en,en
Ask jail deputies,en,np2,en
On other matters  the jury recommended that : ( 1 ),en,en,en
Four additional deputies be employed at the Fulton County Jail and `` a doctor  medical intern or extern be employed for night and weekend duty at the jail '' .,en,en,en
Fulton legislators `` work with city officials to pass enabling legislation that will permit the establishment of a fair and equitable '' pension plan for city employes .,en,en,en
The jury praised the administration and operation of the Atlanta Police Department  the Fulton Tax Commissioner's Office  the Bellwood and Alpharetta prison farms  Grady Hospital and the Fulton Health Department .,en,en,en
Mayor William B. Hartsfield filed suit for divorce from his wife  Pearl Williams Hartsfield  in Fulton Superior Court Friday .,en,en,en
His petition charged mental cruelty .,en,np2,en
The couple was married Aug. 2  1913 .,en,en,en
They have a son  William Berry Jr.  and a daughter  Mrs. J. M. Cheshire of Griffin .,en,en,en
Attorneys for the mayor said that an amicable property settlement has been agreed upon .,en,en,en
The petition listed the mayor's occupation as `` attorney '' and his age as 71 .,en,en,en
It listed his wife's age as 74 and place of birth as Opelika  Ala. .,en,en,en
The petition said that the couple has not lived together as man and wife for more than a year .,en,en,en
The Hartsfield home is at 637 E. Pelham Rd. Aj .,en,en,en
Henry L. Bowden was listed on the petition as the mayor's attorney .,en,en,en
Hartsfield has been mayor of Atlanta  with exception of one brief interlude  since 1937 .,en,en,en
His political career goes back to his election to city council in 1923 .,en,en,en
The mayor's present term of office expires Jan. 1 .,en,en,en
He will be succeeded by Ivan Allen Jr.  who became a candidate in the Sept. 13 primary after Mayor Hartsfield announced that he would not run for reelection .,en,en,en
Georgia Republicans are getting strong encouragement to enter a candidate in the 1962 governor's race  a top official said Wednesday .,en,en,en
Robert Snodgrass  state GOP chairman  said a meeting held Tuesday night in Blue Ridge brought enthusiastic responses from the audience .,np,en,en
State Party Chairman James W. Dorsey added that enthusiasm was picking up for a state rally to be held Sept. 8 in Savannah at which newly elected Texas Sen. John Tower will be the featured speaker .,en,en,en
In the Blue Ridge meeting  the audience was warned that entering a candidate for governor would force it to take petitions out into voting precincts to obtain the signatures of registered voters .,en,en,en
Despite the warning  there was a unanimous vote to enter a candidate  according to Republicans who attended .,en,en,en
When the crowd was asked whether it wanted to wait one more term to make the race  it voted no -- and there were no dissents .,en,en,en
The largest hurdle the Republicans would have to face is a state law which says that before making a first race  one of two alternative courses must be taken : 1,en,en,en
Five per cent of the voters in each county must sign petitions requesting that the Republicans be allowed to place names of candidates on the general election ballot  or 2,en,en,en
The Republicans must hold a primary under the county unit system -- a system which the party opposes in its platform .,en,en,en
Sam Caldwell  State Highway Department public relations director  resigned Tuesday to work for Lt. Gov. Garland Byrd's campaign .,en,en,en
Caldwell's resignation had been expected for some time .,en,en,en
He will be succeeded by Rob Ledford of Gainesville  who has been an assistant more than three years .,en,en,en
When the gubernatorial campaign starts  Caldwell is expected to become a campaign coordinator for Byrd .,en,en,en
The Georgia Legislature will wind up its 1961 session Monday and head for home -- where some of the highway bond money it approved will follow shortly .,en,en,en
Before adjournment Monday afternoon  the Senate is expected to approve a study of the number of legislators allotted to rural and urban areas to determine what adjustments should be made .,en,en,en
Gov. Vandiver is expected to make the traditional visit to both chambers as they work toward adjournment .,en,en,en
Vandiver likely will mention the $100 million highway bond issue approved earlier in the session as his first priority item .,en,en,en
Meanwhile  it was learned the State Highway Department is very near being ready to issue the first $30 million worth of highway reconstruction bonds .,en,en,en
The bond issue will go to the state courts for a friendly test suit to test the validity of the act  and then the sales will begin and contracts let for repair work on some of Georgia's most heavily traveled highways .,en,en,en
A Highway Department source said there also is a plan there to issue some $3 million to $4 million worth of Rural Roads Authority bonds for rural road construction work .,en,en,en
A revolving fund,en,np2,en
The department apparently intends to make the Rural Roads Authority a revolving fund under which new bonds would be issued every time a portion of the old ones are paid off by tax authorities .,en,en,en
Vandiver opened his race for governor in 1958 with a battle in the Legislature against the issuance of $50 million worth of additional rural roads bonds proposed by then Gov. Marvin Griffin .,en,en,en
The Highway Department source told The Constitution  however  that Vandiver has not been consulted yet about the plans to issue the new rural roads bonds .,en,en,en
Schley County Rep. B. D. Pelham will offer a resolution Monday in the House to rescind the body's action of Friday in voting itself a $10 per day increase in expense allowances .,en,en,en
Pelham said Sunday night there was research being done on whether the `` quickie '' vote on the increase can be repealed outright or whether notice would have to first be given that reconsideration of the action would be sought .,en,en,en
While emphasizing that technical details were not fully worked out  Pelham said his resolution would seek to set aside the privilege resolution which the House voted through 87-31 .,en,en,en
A similar resolution passed in the Senate by a vote of 29-5 .,en,en,en
As of Sunday night  there was no word of a resolution being offered there to rescind the action .,en,en,en
Pelham pointed out that Georgia voters last November rejected a constitutional amendment to allow legislators to vote on pay raises for future Legislature sessions .,en,en,en
A veteran Jackson County legislator will ask the Georgia House Monday to back federal aid to education  something it has consistently opposed in the past .,en,en,en
Rep. Mac Barber of Commerce is asking the House in a privilege resolution to `` endorse increased federal support for public education  provided that such funds be received and expended '' as state funds .,en,en,en
Barber  who is in his 13th year as a legislator  said there `` are some members of our congressional delegation in Washington who would like to see it ( the resolution ) passed '' .,en,en,en
But he added that none of Georgia's congressmen specifically asked him to offer the resolution .,en,en,en
The resolution  which Barber tossed into the House hopper Friday  will be formally read Monday .,en,en,en
It says that `` in the event Congress does provide this increase in federal funds ''  the State Board of Education should be directed to `` give priority '' to teacher pay raises .,en,en,en
-- After a long  hot controversy  Miller County has a new school superintendent  elected  as a policeman put it  in the `` coolest election I ever saw in this county '' .,en,en,en
The new school superintendent is Harry Davis  a veteran agriculture teacher  who defeated Felix Bush  a school principal and chairman of the Miller County Democratic Executive Committee .,en,en,en
Davis received 1119 votes in Saturday's election  and Bush got 402 .,en,en,en
Ordinary Carey Williams  armed with a pistol  stood by at the polls to insure order .,en,en,en
`` This was the coolest  calmest election I ever saw ''  Colquitt Policeman Tom Williams said .,en,en,en
`` Being at the polls was just like being at church .,en,en,en
I didn't smell a drop of liquor  and we didn't have a bit of trouble '' .,en,en,en
The campaign leading to the election was not so quiet  however .,en,en,en
It was marked by controversy  anonymous midnight phone calls and veiled threats of violence .,np,en,en
The former county school superintendent  George P. Callan  shot himself to death March 18  four days after he resigned his post in a dispute with the county school board .,en,en,en
During the election campaign  both candidates  Davis and Bush  reportedly received anonymous telephone calls .,np,en,en
Ordinary Williams said he  too  was subjected to anonymous calls soon after he scheduled the election .,np,en,en
Many local citizens feared that there would be irregularities at the polls  and Williams got himself a permit to carry a gun and promised an orderly election .,en,en,en
Sheriff Felix Tabb said the ordinary apparently made good his promise .,en,en,en
`` Everything went real smooth ''  the sheriff said .,en,en,en
`` There wasn't a bit of trouble '' .,en,en,en
Austin  Texas,en,en,en
-- Committee approval of Gov. Price Daniel's `` abandoned property '' act seemed certain Thursday despite the adamant protests of Texas bankers .,en,en,en
Daniel personally led the fight for the measure  which he had watered down considerably since its rejection by two previous Legislatures  in a public hearing before the House Committee on Revenue and Taxation .,en,en,en
Under committee rules  it went automatically to a subcommittee for one week .,en,en,en
But questions with which committee members taunted bankers appearing as witnesses left little doubt that they will recommend passage of it .,en,en,en
Daniel termed `` extremely conservative '' his estimate that it would produce 17 million dollars to help erase an anticipated deficit of 63 million dollars at the end of the current fiscal year next Aug. 31 .,en,en,en
He told the committee the measure would merely provide means of enforcing the escheat law which has been on the books `` since Texas was a republic '' .,en,en,en
It permits the state to take over bank accounts  stocks and other personal property of persons missing for seven years or more .,en,en,en
The bill  which Daniel said he drafted personally  would force banks  insurance firms  pipeline companies and other corporations to report such property to the state treasurer .,en,en,en
The escheat law cannot be enforced now because it is almost impossible to locate such property  Daniel declared .,en,en,en
Dewey Lawrence  a Tyler lawyer representing the Texas Bankers Association  sounded the opposition keynote when he said it would force banks to violate their contractual obligations with depositors and undermine the confidence of bank customers .,en,en,en
`` If you destroy confidence in banks  you do something to the economy ''  he said .,en,en,en
`` You take out of circulation many millions of dollars '' .,en,en,en
Rep. Charles E. Hughes of Sherman  sponsor of the bill  said a failure to enact it would amount `` to making a gift out of the taxpayers' pockets to banks  insurance and pipeline companies '' .,en,en,en
His contention was denied by several bankers  including Scott Hudson of Sherman  Gaynor B. Jones of Houston  J. B. Brady of Harlingen and Howard Cox of Austin .,en,en,en
Cox argued that the bill is `` probably unconstitutional '' since  he said  it would impair contracts .,en,en,en
He also complained that not enough notice was given on the hearing  since the bill was introduced only last Monday .,en,en,en
Austin  Texas,en,en,en
-- Senators unanimously approved Thursday the bill of Sen. George Parkhouse of Dallas authorizing establishment of day schools for the deaf in Dallas and the four other largest counties .,en,en,en
The bill is designed to provide special schooling for more deaf students in the scholastic age at a reduced cost to the state .,en,en,en
There was no debate as the Senate passed the bill on to the House .,en,en,en
It would authorize the Texas Education Agency to establish county-wide day schools for the deaf in counties of 300000 or more population  require deaf children between 6 and 13 years of age to attend the day schools  permitting older ones to attend the residential Texas School for the Deaf here .,en,en,en
Operating budget for the day schools in the five counties of Dallas  Harris  Bexar  Tarrant and El Paso would be $451500  which would be a savings of $157460 yearly after the first year's capital outlay of $88000 was absorbed  Parkhouse told the Senate .,en,en,en
The TEA estimated there would be 182 scholastics to attend the day school in Dallas County  saving them from coming to Austin to live in the state deaf school .,en,en,en
Dallas may get to hear a debate on horse race parimutuels soon between Reps. V. E. ( Red ) Berry and Joe Ratcliff .,en,en,en
While details are still to be worked out  Ratcliff said he expects to tell home folks in Dallas why he thinks Berry's proposed constitutional amendment should be rejected .,en,en,en
`` We're getting more ' pro ' letters than ' con ' on horse race betting ''  said Ratcliff .,en,en,en
`` But I believe if people were better informed on this question  most of them would oppose it also .,en,en,en
I'm willing to stake my political career on it '' .,en,en,en
Rep. Berry  an ex-gambler from San Antonio  got elected on his advocacy of betting on the ponies .,en,en,en
A House committee which heard his local option proposal is expected to give it a favorable report  although the resolution faces hard sledding later .,en,en,en
The house passed finally  and sent to the Senate  a bill extending the State Health Department's authority to give planning assistance to cities .,en,en,en
The senate quickly whipped through its meager fare of House bills approved by committees  passing the three on the calendar .,en,en,en
One validated acts of school districts .,en,en,en
Another enlarged authority of the Beaumont Navigation District .,en,en,en
The third amended the enabling act for creation of the Lamar county Hospital District  for which a special constitutional amendment previously was adopted .,en,en,en
Without dissent  senators passed a bill by Sen. A. R. Schwartz of Galveston authorizing establishment in the future of a school for the mentally retarded in the Gulf Coast district .,en,en,en
Money for its construction will be sought later on but in the meantime the State Hospital board can accept gifts and donations of a site .,en,en,en
Two tax revision bills were passed .,en,en,en
One  by Sen. Louis Crump of San Saba  would aid more than 17000 retailers who pay a group of miscellaneous excise taxes by eliminating the requirement that each return be notarized .,en,en,en
Instead  retailers would sign a certificate of correctness  violation of which would carry a penalty of one to five years in prison  plus a $1000 fine .,en,en,en
It was one of a series of recommendations by the Texas Research League .,en,en,en
The other bill  by Sen. A. M. Aikin Jr. of Paris  would relieve real estate brokers  who pay their own annual licensing fee  from the $12 annual occupation license on brokers in such as stocks and bonds .,en,en,en
Natural gas public utility companies would be given the right of eminent domain  under a bill by Sen. Frank Owen 3  of El Paso  to acquire sites for underground storage reservoirs for gas .,en,en,en
Marshall Formby of Plainview  former chairman of the Texas Highway Commission  suggested a plan to fill by appointment future vacancies in the Legislature and Congress  eliminating the need for costly special elections .,en,en,en
Under Formby's plan  an appointee would be selected by a board composed of the governor  lieutenant governor  speaker of the House  attorney general and chief justice of the Texas Supreme Court .,en,en,en
Austin  Texas,en,en,en
-- State representatives decided Thursday against taking a poll on what kind of taxes Texans would prefer to pay .,en,en,en
An adverse vote of 81 to 65 kept in the State Affairs Committee a bill which would order the referendum on the April 4 ballot  when Texas votes on a U.S. senator .,en,en,en
Rep. Wesley Roberts of Seminole  sponsor of the poll idea  said that further delay in the committee can kill the bill .,en,en,en
The West Texan reported that he had finally gotten Chairman Bill Hollowell of the committee to set it for public hearing on Feb. 22 .,en,en,en
The proposal would have to receive final legislative approval  by two-thirds majorities  before March 1 to be printed on the April 4 ballot  Roberts said .,en,en,en
Opponents generally argued that the ballot couldn't give enough information about tax proposals for the voters to make an intelligent choice .,en,en,en
All Dallas members voted with Roberts  except Rep. Bill Jones  who was absent .,en,en,en
Austin  Texas,en,en,en
-- Paradise lost to the alleged water needs of Texas' big cities Thursday .,en,en,en
Rep. James Cotten of Weatherford insisted that a water development bill passed by the Texas House of Representatives was an effort by big cities like Dallas and Fort Worth to cover up places like Paradise  a Wise County hamlet of 250 people .,en,en,en
When the shouting ended  the bill passed  114 to 4  sending it to the Senate  where a similar proposal is being sponsored by Sen. George Parkhouse of Dallas .,en,en,en
Most of the fire was directed by Cotten against Dallas and Sen. Parkhouse .,en,en,en
The bill would increase from $5000000 to $15000000 the maximum loan the state could make to a local water project .,en,en,en
Cotten construed this as a veiled effort by Parkhouse to help Dallas and other large cities get money which Cotten felt could better be spent providing water for rural Texas .,en,en,en
Statements by other legislators that Dallas is paying for all its water program by local bonds  and that less populous places would benefit most by the pending bill  did not sway Cotten's attack .,en,en,en
The bill's defenders were mostly small-town legislators like J. W. Buchanan of Dumas  Eligio ( Kika ) De La Garza of Mission  Sam F. Collins of Newton and Joe Chapman of Sulphur Springs .,en,en,en
`` This is a poor boy's bill ''  said Chapman .,en,en,en
`` Dallas and Fort Worth can vote bonds .,en,en,en
This would help the little peanut districts '' .,en,en,en
Austin  Texas,en,en,en
-- A Houston teacher  now serving in the Legislature  proposed Thursday a law reducing the time spent learning `` educational methods '' .,en,en,en
Rep. Henry C. Grover  who teaches history in the Houston public schools  would reduce from 24 to 12 semester hours the so-called `` teaching methods '' courses required to obtain a junior or senior high school teaching certificate .,en,en,en
A normal year's work in college is 30 semester hours .,en,en,en
Grover also would require junior-senior high teachers to have at least 24 semester hours credit in the subject they are teaching .,en,en,en
The remainder of the 4-year college requirement would be in general subjects .,en,en,en
`` A person with a master's degree in physics  chemistry  math or English  yet who has not taken Education courses  is not permitted to teach in the public schools ''  said Grover .,np,en,en
College teachers in Texas are not required to have the Education courses .,en,en,en
Fifty-three of the 150 representatives immediately joined Grover as co-signers of the proposal .,en,en,en
Paris  Texas ( sp. ),en,en,en
-- The board of regents of Paris Junior College has named Dr. Clarence Charles Clark of Hays  Kan. as the school's new president .,en,en,en
Dr. Clark will succeed Dr. J. R. McLemore  who will retire at the close of the present school term .,en,en,en
Dr. Clark holds an earned Doctor of Education degree from the University of Oklahoma .,en,en,en
He also received a Master of Science degree from Texas A & I College and a Bachelor of Science degree from Southwestern State College  Weatherford  Okla. .,en,en,en
In addition  Dr. Clark has studied at Rhode Island State College and Massachusetts Institute of Technology .,en,en,en
During his college career  Dr. Clark was captain of his basketball team and was a football letterman .,en,en,en
Dr. Clark has served as teacher and principal in Oklahoma high schools  as teacher and athletic director at Raymondville  Texas  High School  as an instructor at the University of Oklahoma  and as an associate professor of education at Fort Hays  Kan.  State College .,en,en,en
He has served as a border patrolman and was in the Signal Corps of the U.S. Army .,en,en,en
Denton  Texas ( sp. ),en,en,en
-- Principals of the 13 schools in the Denton Independent School District have been re-elected for the 1961-62 session upon the recommendation of Supt. Chester O. Strickland .,en,en,en
State and federal legislation against racial discrimination in employment was called for yesterday in a report of a `` blue ribbon '' citizens committee on the aid to dependent children program .,en,en,en
The report  culminating a year long study of the ADC program in Cook county by a New York City welfare consulting firm  listed 10 long range recommendations designed to reduce the soaring ADC case load .,en,en,en
The report called racial discrimination in employment `` one of the most serious causes of family breakdown  desertion  and ADC dependency '' .,en,en,en
`` Must solve problem '',en,np2,en
The monthly cost of ADC to more than 100000 recipients in the county is 4.4 million dollars  said C. Virgil Martin  president of Carson Pirie Scott & Co.  committee chairman .,en,en,en
`` We must solve the problems which have forced these people to depend upon ADC for subsistence ''  Martin said .,en,en,en
