The defendant  William L. Stickney 3  23  of 3211 Park pl.  Evanston  who pleaded guilty to reckless driving  also was ordered by Judge James Corcoran to attend the Evanston traffic school each Tuesday night for one month .,en,en,en
Stickney is a salesman for Plee-Zing  Inc.  2544 Green Bay Rd.  Evanston  a food brokerage and grocery chain firm  of which his father  William L. Jr.  is president .,en,en,en
Patrolman James F. Simms said he started in pursuit when he saw young Stickney speeding north in Stewart Avenue at Central Street .,en,en,en
At Jenks Street  Simms said  the car skidded completely around  just missed two parked cars  and sped east in Jenks .,en,en,en
The car spun around again  Simms said  before Stickney could turn north in Prairie Avenue  and then violated two stop lights as he traveled north into Wilmette in Prairie .,en,en,en
St. Johns  Mich.  April 19 .,en,en,en
-- A jury of seven men and five women found 21-year-old Richard Pohl guilty of manslaughter yesterday in the bludgeon slaying of Mrs. Anna Hengesbach .,en,en,en
Pohl received the verdict without visible emotion .,en,en,en
He returned to his cell in the county jail  where he has been held since his arrest last July  without a word to his court-appointed attorney  Jack Walker  or his guard .,en,en,en
The verdict brought vindication to the dead woman's stepson  Vincent Hengesbach  54  who was tried for the same crime in December  1958  and released when the jury failed to reach a verdict .,en,en,en
Mrs. Hengesbach was killed on Aug. 31  1958 .,en,en,en
Hengesbach has been living under a cloud ever since .,en,en,en
When the verdict came in against his young neighbor  Hengesbach said :,en,en,en
`` I am very pleased to have the doubt of suspicion removed .,en,en,en
Still  I don't wish to appear happy at somebody else's misfortune '' .,en,en,en
Lives on welfare,en,en,en
Hengesbach  who has been living on welfare recently  said he hopes to rebuild the farm which was settled by his grandfather in Westphalia  27 miles southwest of here .,en,en,en
Hengesbach has been living in Grand Ledge since his house and barn were burned down after his release in 1958 .,en,en,en
Pohl confessed the arson while being questioned about several fires in the Westphalia area by State Police .,en,en,en
He also admitted killing Mrs. Hengesbach .,en,en,en
However  the confession  which was the only evidence against him  was retracted before the trial .,en,en,en
Charges in doubt,en,en,en
Assistant Prosecutor Fred Lewis  who tried both the Hengesbach and Pohl cases  said he did not know what would be done about two arson charges pending against Pohl .,en,en,en
Circuit Judge Paul R. Cash did not set a date for sentencing .,en,en,en
Pohl could receive from 1 to 15 years in prison or probation .,en,en,en
Walker said he was considering filing a motion for a new trial which would contend that the verdict was against the weight of the evidence and that there were several errors in trial procedure .,en,en,en
Locked in motel,en,en,en
A verdict against Pohl came at 4:05 p.m. after almost 13-1/2 hours of deliberation .,en,en,en
The jury  which was locked up in a motel overnight  was canvassed at the request of Walker after the verdict was announced .,en,en,en
The jury foreman  Mrs. Olive Heideman  of rural Elsie  said that a ballot was not even taken until yesterday morning and that the first day of deliberation was spent in going over the evidence .,en,en,en
She said the jurors agreed that Pohl's confession was valid .,en,en,en
The jury asked Judge Cash to send in his written definition of the difference between first and second-degree murder and manslaughter .,en,en,en
The verdict came three hours later .,en,en,en
Some 30 spectators remained in the court during the day and were on hand to hear the verdict read .,en,en,en
The trial had packed the large courtroom for more than a week .,en,en,en
A Sterling Township family of six surviving children  whose mother died yesterday as the aftermath to a fire that also killed one of the children  found today they had the help of hundreds of neighbors and school friends .,en,en,en
While neighbor women assumed some of the dead mother's duties  fund-raising events were being planned by a homeowners association and a student council for the hard-hit Henry Kowalski family  34220 Viceroy .,en,en,en
Mrs. Eleanor Kowalski  42  died yesterday afternoon in Holy Cross Hospital of burns suffered in a fire that followed a bottled gas explosion Saturday night at the flat of her widowed mother  Mrs. Mary Pankowski  in the adjoining suburb of Warren .,en,en,en
Funeral services for Mrs. Kowalski and her daughter  Christine  11  who died of burns at the same hospital Monday  have been scheduled for 10 a.m. tomorrow in St. Anne's Catholic Church  31978 Mound  in Warren .,en,en,en
The mother and daughter  who will be buried side by side in Mt. Olivet Cemetery  rested together today in closed caskets at the Lyle Elliott Funeral Home  31730 Mound  Warren .,en,en,en
Mrs. Pankowski  61  remained in Holy Cross Hospital as a result of the explosion  which occurred while Mrs. Kowalski fueled a cook stove in the grandmother's small upstairs flat at 2274 Eight Mile Road East .,en,en,en
Assistant Fire Chief Chester Cornell said gas fumes apparently were ignited by a candle which one of the three Kowalski girls present held for her mother  because the flat lacked electricity .,en,en,en
Christine's twin sister  Patricia  and Darlene Kowalski  8  escaped with minor burns .,en,en,en
They are home now with the other Kowalski children  Vicky  14 ; ;,en,en,en
Dennis  6 ; ;,en,en,en
Eleanor  2 ; ;,en,en,en
and Bernardine  1 .,en,en,en
`` All we have left in the world is one another  and we must stay together the way Mother wanted ''  Kowalski said in telling his children of their mother's death yesterday afternoon .,en,en,en
Kowalski  a roofer who seldom worked last winter  already was in arrears on their recently purchased split-level home when the tragedy staggered him with medical and funeral bills .,en,en,en
Neighbor women  such as Mrs. Sidney Baker  2269 Serra  Sterling Township  have been supplying the family with meals and handling household chores with Kowalski's sister-in-law  Mrs. Anna Kowalski  22111 David  East Detroit .,en,en,en
Another neighbor  Mrs. Frank C. Smith  2731 Pall Mall  Sterling Township  surprised Kowalski by coming to the home yesterday with $135 collected locally toward the $400 funeral costs .,en,en,en
John C. Houghton  president of the Tareytown Acres Homeowners Association  followed that by announcing plans last night for a door-to-door fund drive throughout their subdivision on behalf of the Kowalski family .,en,en,en
Students help out,en,en,en
Houghton said 6 p.m. Friday had been set for a canvass of all 480 homes in the subdivision  which is located northeast of Dequindre and 14 Mile Road East .,en,en,en
He said contributions also could be mailed to Post Office Box 553  Warren Village Station .,en,en,en
Vicky Kowalski meanwhile learned that several of her fellow students had collected almost $25 for her family during the lunch hour yesterday at Fuhrmann Junior High School  5155 Fourteen Mile road east .,en,en,en
Principal Clayton W. Pohly said he would allow a further collection between classes today  and revealed that Y-Teen Club past surpluses had been used to provide a private hospital nurse Monday for Mrs. Kowalski .,en,en,en
Funds from dances,en,en,en
Student Council officers announced today the Kowalski family would be given the combined proceeds from a school dance held two weeks ago  and another dance for Fuhrmann's 770 students this Friday night .,en,en,en
`` Furhmann's faculty is proud that this has been a spontaneous effort  started largely among the students themselves  because of fondness for Vicky and sympathy for her entire family  Pohly said .,en,en,en
There also were reports of a collection at the County Line Elementary School  3505o Dequindre  which has been attended this year by four of the Kowalski children including Christine .,en,en,en
Kowalski has spoken but little since the fire last Saturday .,en,en,en
But today he wanted to make a public statement .,en,en,en
`` I never knew there were such neighbors and friends around me and my family .,en,en,en
I wasn't sure there were such people anywhere in the world .,en,en,en
I'll need more than a single day to find the words to properly express my thanks to them '' .,en,en,en
An alert 10-year-old safety patrol boy was congratulated by police today for his part in obtaining a reckless driving conviction against a youthful motorist .,en,en,en
Patrolman George Kimmell  of McClellan Station  said he would recommend a special safety citation for Ralph Sisk  9230 Vernor east  a third grader at the Scripps School  for his assistance in the case .,en,en,en
Kimmell said he and Ralph were helping children across Belvidere at Kercheval Monday afternoon when a car heading north on Belvidere stopped belatedly inside the pedestrian crosswalk .,en,en,en
Gets car number,en,np2,en
Kimmell ordered the driver to back up  watched the children safely across and was approaching the car when it suddenly `` took off at high speed ''  he said  narrowly missing him .,en,en,en
Commandeering a passing car  Kimmell pursued the fleeing vehicle  but lost it in traffic .,en,en,en
Returning to the school crossing  the officer was informed by the Sisk boy that he recognized the driver  a neighbor  and had obtained the license number .,en,en,en
The motorist later was identified as Richard Sarkees  17  of 2433 McClellan  currently on probation and under court order not to drive .,en,en,en
Given 15 days,en,np,en
He was found guilty of reckless driving yesterday by Traffic Judge George T. Murphy  who continued his no-driving probation for another year and ordered him to spend 15 days in the Detroit House of Correction .,en,en,en
The jail sentence is to begin the day after Sarkees graduates from Eastern High School in June .,en,en,en
The long crisis in Laos appeared nearing a showdown today .,en,en,en
Britain announced that it is asking the Soviet Union to agree tomorrow to an immediate cease-fire .,en,en,en
In Vientiane  the royal Laotian government decided today to ask its `` friends and neighbors '' for help in fighting what it called a new rebel offensive threatening the southeast Asian kingdom .,en,en,en
Britain's plans to press Russia for a definite cease-fire timetable was announced in London by Foreign Secretary Lord Home .,en,en,en
He said Britain also proposed that the international truce commission should be reconvened  sent to New Delhi and from there to Laos to verify the cease-fire .,en,en,en
A 14-power conference on Laos should then meet on May 5  he said .,en,en,en
Plea for arms,en,en,en
The Laos government plea for help was made by Foreign Minister Tiao Sopsaisana .,en,en,en
He indicated that requests would be made for more U.S. arms and more U.S. military advisers .,en,en,en
He declared the government is thinking of asking for foreign troops if the situation worsens .,en,en,en
One of the first moves made after a cabinet decision was to request the United States to establish a full-fledged military assistance group instead of the current civilian body .,en,en,en
A note making the request was handed to U.S. Ambassador Winthrop G. Brown .,en,en,en
The Laos government said four major Pathet Lao rebel attacks had been launched  heavily supported by troops from Communist North Viet Nam .,en,en,en
The minister  describing the attacks which led up to the appeal  said that 60000 Communist North Vietnamese were fighting royal army troops on one front -- near Thakhek  in southern-central Laos .,en,en,en
There was no confirmation of such massive assaults from independent sources .,en,en,en
In the past such government claims have been found exaggerated .,en,en,en
Havana  April 19 .,en,en,en
-- Two Americans and seven Cubans were executed by firing squads today as Castro military tribunals began decreeing the death penalty for captured invasion forces and suspected collaborators .,en,en,en
A Havana radio broadcast identified the Americans as Howard Anderson and August Jack McNair .,en,en,en
The executions took place at dawn only a few hours after Havana radio announced their conviction by a revolutionary tribunal at Pinar Del Rio  where the executions took place .,np,en,en
Arms plot charged,en,np2,en
The broadcast said Anderson  a Seattle ex-marine and Havana businessman  and McNair  of Miami  were condemned on charges of smuggling arms to Cuban rebels .,en,en,en
Anderson operated three Havana automobile service stations and was commander of the Havana American Legion post before it disbanded since the start of Fidel Castro's regime .,en,en,en
Anderson's wife and four children live in Miami .,en,en,en
McNair  25  was seized March 20 with four Cubans and accused of trying to land a boatload of rifles in Pinar Del Rio  about 35 miles from Havana .,np,en,en
Report others held,en,en,en
At least 20 other Americans were reported to have been arrested in a mass political roundup .,en,en,en
Among them were a number of newsmen  including Henry Raymont  of United Press International  and Robert Berrellez  of Associated Press .,en,en,en
So many Cubans were reported being swept into the Castro dragnet that the massive Sports Palace auditorium and at least one hotel were converted into makeshift jails .,en,en,en
More than 1000 were said to have been arrested -- 100 of them Roman Catholic priests .,en,en,en
Of the millions who have served time in concentration camps in Siberia as political prisoners of the Soviet state  few emerge in the West to tell about it .,en,en,en
M. Kegham -- the name is a pseudynom -- was a teacher in Bucharest and a member of the Armenian Revolutionary Federation ( ARF ) -- two reasons the Communists put him away when they arrived in 1945 .,en,en,en
Today  M. Kegham was in Detroit  en route to join his wife and children in California .,en,en,en
Emory University's Board of Trustees announced Friday that it was prepared to accept students of any race as soon as the state's tax laws made such a step possible .,en,en,en
`` Emory University's charter and by-laws have never required admission or rejection of students on the basis of race ''  board chairman Henry L. Bowden stated .,en,en,en
But an official statement adopted by the 33-man Emory board at its annual meeting Friday noted that state taxing requirements at present are a roadblock to accepting Negroes .,en,en,en
The statement explained that under the Georgia Constitution and state law  tax-exempt status is granted to educational institutions only if they are segregated .,en,en,en
`` Emory could not continue to operate according to its present standards as an institution of higher learning  of true university grade  and meet its financial obligations  without the tax-exemption privileges which are available to it only so long as it conforms to the aforementioned constitutional and statutory provisions ''  the statement said .,en,en,en
The statement did not mention what steps might be taken to overcome the legal obstacles to desegregation .,en,en,en
An Emory spokesman indicated  however  that the university itself did not intend to make any test of the laws .,en,en,en
The Georgia Constitution gives the Legislature the power to exempt colleges from property taxation if  among other criteria  `` all endowments to institutions established for white people shall be limited to white people  and all endowments to institutions established for colored people shall be limited to colored people '' .,en,en,en
At least two private colleges in the Atlanta area now or in the past have had integrated student bodies  but their tax-exempt status never has been challenged by the state .,en,en,en
Emory is affiliated with the Methodist Church .,en,en,en
Some church leaders  both clerical and lay  have criticized the university for not taking the lead in desegregation .,en,en,en
Urged in 1954,en,en,en
The student newspaper  The Emory Wheel  as early as the fall of 1954 called for desegregation .,en,en,en
`` From its beginning ''  the trustees' statement said Friday  `` Emory University has assumed as its primary commitment a dedication to excellence in Christian higher learning .,en,en,en
Teaching  research and study  according to highest standards  under Christian influence  are paramount in the Emory University policy .,en,en,en
`` As a private institution  supported by generous individuals  Emory University will recognize no obligation and will adopt no policy that would conflict with its purpose to promote excellence in scholarship and Christian education .,en,en,en
`` There is not now  nor has there ever been in Emory University's charter or by-laws any requirement that students be admitted or rejected on the basis of race  color or creed .,en,en,en
Insofar as its own governing documents are concerned  Emory University could now consider applications from prospective students  and others seeking applications from prospective students  and others seeking the opportunity to study or work at the university  irrespective of race  color or creed .,en,en,en
`` On the other hand  Emory University derives its corporate existence from the State of Georgia .,en,en,en
`` When and if it can do so without jeopardizing constitutional and statutory tax-exemption privileges essential to the maintenance of its educational program and facilities  Emory University will consider applications of persons desiring to study or work at the University without regard to race  color or creed  continuing university policy that all applications shall be considered on the basis of intellectual and moral standards and other criteria designed to assure the orderly and effective conduct of the university and the fulfillment of its mission as an institution of Christian higher education '' .,en,en,en
A young man was killed and two others injured at midnight Friday when the car they were riding slid into a utility pole on Lake Avenue near Waddell Street  NE  police said .,en,en,en
The dead youth was identified as Robert E. Sims  19  of 1688 Oak Knoll Cir.  Aj .,en,en,en
Patrolman G. E. Hammons said the car evidently slid out of control on rain-slick streets and slammed into the pole .,en,en,en
The other occupants were James Willard Olvey  18  of 963 Ponce De Leon Ave.  NE  and Larry Coleman Barnett  19  of 704 Hill St.  SE  both of whom were treated at Grady Hospital for severe lacerations and bruises .,en,en,en
The Atlanta Negro student movement renewed its demands for movie theater integration Friday and threatened picketing and `` stand-ins '' if negotiations failed .,np,en,en
The demands were set forth in letters to seven owners of first-run theaters by the Committee on Appeal for Human Rights .,en,en,en
' intend to attend ',en,en,en
`` We intend to attend the downtown theaters before the first of the year ''  the identically worded letters said .,en,en,en
The letters set a Nov. 15 deadline for the start of negotiations .,en,en,en
They indicated that stand-ins and picketing would be started if theater owners failed to cooperate .,np,en,en
Downtown and art theater managers and owners  contacted Friday night for comment on the COAHR request  said they had no knowledge of such a letter  and that it was not in the Friday mail .,np,en,en
However  three of the managers did say that they would agree to attend the proposed meeting if all of the other managers decided to attend .,en,en,en
The COAHR letter comes on the eve of a large gathering of theater managers and owners scheduled to begin here Sunday .,np,en,en
Several theater operators said  however  that there is little likelihood of the subject being discussed during the three-day affair .,np,en,en
Student leaders began sporadic efforts to negotiate theater integration several months ago .,np,en,en
Charles A. Black  COAHR chairman  said Friday that three theater representatives had agreed to meet with the students on Oct. 31 but had failed to show up .,np,en,en
He declined to name the three .,en,en,en
Friday's letters asked for a Nov. 15 meeting .,en,en,en
Failure to attend the meeting or explain inability to attend  the letters said  would be considered a `` sign of indifference '' .,en,en,en
Black said COAHR `` hoped to be able to integrate the theaters without taking direct action  but we are pledged to using every legal and nonviolent means at our disposal '',en,en,en
A prepared statement released by the student group Friday stated that `` extensive research by COAHR into techniques and methods of theater integration in other cities indicated that the presence of picket lines and stand-ins before segregated theaters causes a drop in profits '',np,en,en
Besides managers of downtown theaters  the students sent letters to owners of art theaters in the uptown area and Buckhead .,en,en,en
R. E. Killingsworth,en,np2,en
Raymond E. Killingsworth  72  died Sunday at his home at 357 Venable St.  Aj .,en,en,en
Mr. Kililngsworth was a foreman with S and W Cafeteria .,en,en,en
He was born in Pittsboro  Miss.  and was a veteran of World War 1 .,en,en,en
He was a member of the Baptist church .,en,en,en
Survivors include two brothers  C. E. Killingsworth  Atlanta  and John Killingsworth  Warren  Ohio ; ;,en,en,en
and two sisters  Miss Minnie Kililngsworth and Mrs. Bessie Bloom  both of Gettysburg  Pa. .,en,en,en
John W. Ball,en,np2,en
John William Ball  68  of 133 Marietta St. NW  Apartment 101b  died Sunday at his home .,en,en,en
Mr. Ball was a house painter .,en,en,en
He was a member of the Oakland City Methodist Church and a native of Atlanta .,en,en,en
Funeral services will be at 2 p.m. Tuesday at Blanchard's Chapel with the Rev. J. H. Hearn officiating .,en,en,en
Survivors include his sister  Mrs. Emma B. Odom of Atlanta .,en,en,en
Mrs. Lola Harris,en,np2,en
Mrs. Lola M. Harris  a native of Atlanta  died Sunday at her home in Garland  Tex. .,en,en,en
Survivors include a son  Charles R. Fergeson  Memphis  Tenn. ; ;,en,en,en
two daughters  Mrs. Gene F. Stoll and Miss Nancy Harris  both of Garland ; ;,en,en,en
her father  H. T. Simpson  Greenville  S.C.  and three sisters  Mrs. W. E. Little and Mrs. Hal B. Wansley  both of Atlanta  and Mrs. Bill Wallace  Wilmington  N.C. .,en,en,en
A 24-year-old Atlanta man was arrested Sunday after breaking into the home of relatives in search of his wife  hitting his uncle with a rock and assaulting two police officers who tried to subdue him  police said .,en,en,en
Patrolmen J. W. Slate and A. L. Crawford Jr. said they arrested Ronald M. Thomas  of 1671 Nakoma St.  NW  after he assaulted the officers .,en,en,en
The officers gave this account :,en,en,en
Thomas early Sunday went to the home of his uncle and aunt  Mr. and Mrs. R. C. Thomas  511 Blanche St.  NW  looking for his wife  Margaret Lou Thomas  18  and their 11-month-old baby .,en,en,en
The younger Thomas ripped a screen door  breaking the latch  and after an argument struck his uncle with a rock  scratching his face .,en,en,en
He also struck his aunt and wife  and during the melee the baby also suffered scratches .,en,en,en
When police arrived the man was still violent  Slate said .,en,en,en
He attacked one of the officers and was restrained .,en,en,en
About five minutes later he jumped up  Slate said  and struck the two policemen again .,en,en,en
He was then subdued and placed in the police car to be taken to Grady Hospital for treatment of scratches received in the melee .,en,en,en
Then he attacked the two officers again and was again restrained  Slate related .,en,en,en
Slate said he and Crawford received cuts and scratches and their uniforms were badly torn .,en,en,en
Thomas was charged with four counts of assault and battery .,en,en,en
Two counts of assault on an officer  resisting arrest  disturbance and cursing  police said .,en,en,en
A hearing was set for 30 a.m. Tuesday .,en,en,en
Mrs. Mary Self  who knows more than any other person about the 5000 city employes for whom she has kept personnel records over the years  has closed her desk and retired .,en,en,en
Over the weekend  Mrs. Self  personnel clerk  was a feted and honored guest of the Atlanta Club  organization of women employes at City Hall .,en,en,en
After 18 years in the personnel office  she has taken a disability pension on advice of her doctors .,en,en,en
As personnel clerk  she handled thousands of entries  ranging from appointments to jobs  to transfers to other employments  to pensions .,en,en,en
`` I have enjoyed it and will feel a bit lost at least for a while ''  she said wistfully Friday .,en,en,en
One of the largest crowds in the club's history turned out to pay tribute to Mrs. Self and her service .,en,en,en
Georgia's Department of Agriculture is intensifying its fire ant eradication program in an effort to stay ahead of the fast-spreading pest .,en,en,en
The department is planning to expand its eradication program soon to four additional counties -- Troup  Pierce  Bryan and Bulloch -- to treat 132000 acres infested by the ants  according to W. E. Blasingame state entomologist .,en,en,en
Low-flying planes will spread a granular-type chemical  heptachlor  over 30000 acres in Troup  37000 acres in Pierce and 65000 acres in Bulloch and Bryan counties .,en,en,en
The eradication effort is being pushed in Bibb and Jones counties  over 37679 acres .,en,en,en
The department has just finished treating 20000 acres in urban areas of Macon .,en,en,en
Also being treated are Houston  Bleckley  Tift  Turner and Dodge counties  Blasingame said .,en,en,en
The fire ant is thought to infest approximately two million acres of land in Georgia  attacking crops  young wildlife and livestock and can be a serious health menace to humans who are allergic to its venom  Blasingame said .,en,en,en
